Reviewer,Title,Reviews,Star_rating,Rating,Date,Reviews_posted,Location,Reviews_clean,Title_clean
Matthew,Lost a loyal customer - rude staff and internal process inadequate,"I have been a loyal Nike member since 2013 and ordered many of times over the years. I placed an order on the 31st August 2020 for a pair of trainers, which I paid with a gift voucher and applied a 25% promo at the time. 8th September I received an email to notify of delay in order due to stock. After speaking to several people, asking when it would be dispatched, they offered an extra 15% off as a gesture. (Acceptable at the time) however to this day it was still stuck 'In progress' when they had already put stock back on their website. 1 agent said they would email the warehouse to process the order quickly. Another agent told me they couldn't email the warehouse? I was also told that delayed orders are prioritised over new orders, but then another agent stated from their experience, cancelling the order and reordering again would be quicker!? I asked if a manager could call me to discuss the issue, as I cannot believe in 2020 no one can simply put a call/email into the warehouse to speed up a delivery which has been delayed significantly. Never received a call after being promised someone would call me on either the Saturday or Monday just gone. No emails received either. I then decided to call today to simply cancel the order and reorder, to my annoyance that I was told that they cannot honour the 25% promo code again but would have to reimburse, once Ive paid full price!? The worst part of this experience which topped it for me, I spoke to Ryan today, who in all my years of interaction with a customer service rep, have I spoke to someone who is so rude and confrontational. I was gobsmacked by his tone of voice, which was aggressive and he assumed upon previous notes, (He was very quick to tell me notes his colleague left). I am still shocked by the way he spoke to me. He is based in Dublin/Ireland where most of their customer service is. I have now cancelled and left short of order. - Goes well if stocks in place but if something delays, be prepared for a nightmare. If you want Nike products i would go via 3rd Parties and not direct because their clearly is no consequence for staff who act inappropriately.",1,Bad,2020-09-24,4,United Kingdom,loyal nike member since ordered many times years placed order st august pair trainers paid gift voucher applied promo time th september received email notify delay order due stock speaking several people asking would dispatched offered extra gesture acceptable time however day still stuck progress already put stock back website agent said would email warehouse process order quickly another agent told couldnt email warehouse also told delayed orders prioritised new orders another agent stated experience cancelling order reordering would quicker asked manager could call discuss issue cannot believe one simply put callemail warehouse speed delivery delayed significantly never received call promised someone would call either saturday monday gone emails received either decided call today simply cancel order reorder annoyance told cannot honour promo code would reimburse ive paid full price worst part experience topped spoke ryan today years interaction customer service rep spoke someone rude confrontational gobsmacked tone voice aggressive assumed upon previous notes quick tell notes colleague left still shocked way spoke based dublinireland customer service cancelled left short order goes well stocks place something delays prepared nightmare want nike products would go via rd parties direct clearly consequence staff act inappropriately,lost loyal customer rude staff internal process inadequate
Aydin,waiting to long for delivery,,4,Great,2020-09-24,4,Kuwait,,waiting long delivery
Danielle McC,My daughter loves her sports clothing…,"My daughter loves her sports clothing and Nike are always on her list of wants. Wish they offered some discounts more regularly. Apart from that, hassle free when ordering :)",3,Average,2020-09-22,5,United Kingdom,daughter loves sports clothing nike always list wants wish offered discounts regularly apart hassle free ordering,daughter loves sports clothing…
Miss G.,Nike store experience,Purchased several pairs of Nike for family members. Prices were cheaper than Foot Locker or any other stores like it. Purchased Nike's at a discounted price and saved quite a bit. Great customer service and great prices. Will visit Nike store again!!,4,Great,2020-09-22,6,United States,purchased several pairs nike family members prices cheaper foot locker stores like purchased nikes discounted price saved quite bit great customer service great prices visit nike store,nike store experience
Jamal Ismail M,I purchased multiple shoes for my…,I purchased multiple shoes for my family and I. Always had a great experience.Thank you,5,Excellent,2020-09-17,1,Canada,purchased multiple shoes family always great experiencethank,purchased multiple shoes my…
Frank Edward,Very happy with my new kicks and…,Very happy with my new kicks and satisfied with their customer service!,5,Excellent,2020-09-16,2,United States,happy new kicks satisfied customer service,happy new kicks and…
Aatif Shaikh,Good Products,The new autumn collection is nice. Please increase the production of Nike Air Jordan Collection.,5,Excellent,2020-09-16,3,United States,new autumn collection nice please increase production nike air jordan collection,good products
Knut Helge Mowinckel,Horrible customer service!!!!!!,"Worst customer service I have experienced! Ordered Liverpool's new kit. Got kid Large size. Wrong size for an adult. Delivered returned on 24 August. Haven't heard anything from Nike since that day. Stay away!!!!! Never, ever more Nike!!!!Last: Still not heard anything from Nike. They do not respond to customer inquiries. Have sent two emails to them. Consider the money lost.",1,Bad,2020-09-14,11,Norway,worst customer service experienced ordered liverpools new kit got kid large size wrong size adult delivered returned august havent heard anything nike since day stay away never ever nikelast still heard anything nike respond customer inquiries sent two emails consider money lost,horrible customer service
Josh Warren,Took forever to get my shoes!,,2,Poor,2020-09-10,2,United States,,took forever get shoes
Durval,Took a month to get my stuff not happy,,2,Poor,2020-09-10,1,Czech Republic,,took month get stuff happy
Sheldon Coutinho,Late Delivery,The product quality was amazing but the delivery service was not good the shoebox was damage and I received my package not as per given delivery date it was delayed by 1 week.,3,Average,2020-09-08,2,United States,product quality amazing delivery service good shoebox damage received package per given delivery date delayed week,late delivery
Lu,Fresh kicks baby,Get a fresh pair of air max or forces every month. If it wasn’t for Nike I’d be bare foot won’t ever see a different brand on my feet. Thinking about getting my first custom pair next.,5,Excellent,2020-09-07,6,United States,get fresh pair air max forces every month wasn’t nike i’d bare foot won’t ever see different brand feet thinking getting first custom pair next,fresh kicks baby
Marte,Wrong size - never got the money back,"I have bought a lot from Nike.com and previously been satisfied, but the last time, they sent me the item in  another size than the one I ordered. I ask them to kindly send me the right size, but they said I had to by a new one, and return the other one that they sent wrong, without any compensation. Its now been three months (!) and they still haven't transferred my money back. I guess Im done shopping at nike.com.",2,Poor,2020-09-05,1,Norway,bought lot nikecom previously satisfied last time sent item another size one ordered ask kindly send right size said new one return one sent wrong without compensation three months still havent transferred money back guess im done shopping nikecom,wrong size never got money back
Anastasia Reyes,Supports fraud horrible company,"One thing I will say about this company is that it's horrible. Allowing fraudulent purchases be viewed as authentic purchases. I've call 3 times about a purchase I never made and it is clear as freakin day that it was sent to a different location from were i have been living for 14yrs. Your company policy states it was an authentic order and if i want my money back I have to return the product. How can I return a product I never received nor did I order to know what it was to even return. You know who ordered the product why not charge them? go after them? since they technically didn't pay for YOUR products and just return the money that is mine that your customer used to fraudulently pay for your products. It's blatantly clear this company runs on absolute greed and fraud and doesn't care about actual justifiable facts. I will be taking legal action.Absolutely Disgraceful, I was never even a customer, but now after this I will NEVER support Nike in any way along with my family and friends.",1,Bad,2020-09-03,5,United States,one thing say company horrible allowing fraudulent purchases viewed authentic purchases ive call times purchase never made clear freakin day sent different location living yrs company policy states authentic order want money back return product return product never received order know even return know ordered product charge go since technically didnt pay products return money mine customer used fraudulently pay products blatantly clear company runs absolute greed fraud doesnt care actual justifiable facts taking legal actionabsolutely disgraceful never even customer never support nike way along family friends,supports fraud horrible company
Pavel Tanase,Found my favorite shoes on sale 💣💪,,5,Excellent,2020-09-01,3,Romania,,found favorite shoes sale 💣💪
Norah heger,I went in the shop close to my house…,I went in the shop close to my house and i have to say that i had a perfect experience. A sales person took care of me and gave me advices to have lower prices all year. they take care of their customers,5,Excellent,2020-08-25,4,France,went shop close house say perfect experience sales person took care gave advices lower prices year take care customers,went shop close house…
Nadja Ocepek,"Didn't get my order, no refund",I bought a gift card for my friend's birthday on July 7th. Until today the card didn't arrive. Every conversation with support until now was useless and I am still waiting for the refund. As far as I'm concerned Nike practically stole my money.,1,Bad,2020-08-23,1,Slovenia,bought gift card friends birthday july th today card didnt arrive every conversation support useless still waiting refund far im concerned nike practically stole money,didnt get order refund
grace geiger,Disgusted,I am a true American and I stand with my flag with my hand over my hear.  🇺🇸🇱🇷❤️🤍💙 U•S•A•,1,Bad,2020-08-23,3,United States,true american stand flag hand hear 🇺🇸🇱🇷❤️🤍💙 u•s•a•,disgusted
Everett,I bought NikeCourt Air Zoom Vapor Cage…,"I bought NikeCourt Air Zoom Vapor Cage 4, with bright gree color. They are very comfortable, right my fitting. Playing sports is convenient wearing these boots.",5,Excellent,2020-08-20,2,Germany,bought nikecourt air zoom vapor cage bright gree color comfortable right fitting playing sports convenient wearing boots,bought nikecourt air zoom vapor cage…
THORE,Taking care of customers,"I bought a pair of quite expensive shoes for my son. After a few months, some of the color began to peel off. I contacted Nike, and the response and help I received there was incredibly good. Full refund and a fantastic follow-up and dialogue along the way. Nike has understood how to take care of customers!",5,Excellent,2020-08-19,7,Norway,bought pair quite expensive shoes son months color began peel contacted nike response help received incredibly good full refund fantastic followup dialogue along way nike understood take care customers,taking care customers
anh nguyen,Misleading consumers,Ordered two separate orders online under men Shoes sale section on different date. The worst part is My credit card been fully charged and billed but 2 days later email from Nike advised they cancelled my both orders because they don’t have stocks. WTH if you don’t have stock DONT advertised. This is misleading breach and false advertising. The amuse part is nike websites still advertise the unavailable shoes!!!!!I am still waiting for refund and this is first time shopping with Nike and will be the last. Beware people shop else where.,1,Bad,2020-08-15,1,New Zealand,ordered two separate orders online men shoes sale section different date worst part credit card fully charged billed days later email nike advised cancelled orders don’t stocks wth don’t stock dont advertised misleading breach false advertising amuse part nike websites still advertise unavailable shoesi still waiting refund first time shopping nike last beware people shop else,misleading consumers
Stephen Bowman,I will never buy your products while…,I will never buy your products while you sponsor the bent and corrupt English Premier league. Shame on you.,1,Bad,2020-08-12,11,United Kingdom,never buy products sponsor bent corrupt english premier league shame,never buy products while…
Bridgett Banks,Fast delivery,"Fast delivery, shoes are amazing",5,Excellent,2020-08-11,6,Czech Republic,fast delivery shoes amazing,fast delivery
Saul Candanosa,Love it one of the best sites ever,Love it one of the best sites ever . Love mostly everything you guys have,5,Excellent,2020-08-08,2,United States,love one best sites ever love mostly everything guys,love one best sites ever
Daily Health,The best prices for official kicks,The best prices for official kicks. You can't beat it.,5,Excellent,2020-08-08,3,United States,best prices official kicks cant beat,best prices official kicks
Nick L.,I can't even wear other brands' shoes…,I can't even wear other brands' shoes but Nike. their are great and the size is just perfect for me. I can never find the fit with other shoes.,5,Excellent,2020-08-07,3,Czech Republic,cant even wear brands shoes nike great size perfect never find fit shoes,cant even wear brands shoes…
Hakim,I would give 0 if I could,One of the worst customer service experience I bought shoes that had a manufacturing defect with the sizing and was told by advisors they can't do anything so I asked to speak to a manager and had to wait 1 week with constant calling to receive a call and the manager was very rude and did not even attempt to resolve and accused his staff of lying and offered less that was offered by the advisors and terminated the call without any solution. When asked to speak to someone higher he advised there's no one and to take the business to court JUST WOW.I WOULD ADVISE TO AVOID THIS COMPANY AT ALL COSTS.,1,Bad,2020-08-07,2,United Kingdom,one worst customer service experience bought shoes manufacturing defect sizing told advisors cant anything asked speak manager wait week constant calling receive call manager rude even attempt resolve accused staff lying offered less offered advisors terminated call without solution asked speak someone higher advised theres one take business court wowi would advise avoid company costs,would give could
Maree,Worth the money and cant go wrong.,Worth the money and cant go wrong. Helping me get fit🤼‍♀️🏃‍♀️,5,Excellent,2020-08-05,5,Australia,worth money cant go wrong helping get fit🤼‍♀️🏃‍♀️,worth money cant go wrong
Hélène Schrooyen,The customer service is the worst I’ve…,"The customer service is the worst I’ve ever come across. I cancelled an order of 200€ TWO MONTHS ago and never received my money back. Every time I call they tell me something different. First they told me I’d receive the money within 7 working days, then they told me they never received the payment (that’s why they never paid me), then I sent them proof of payment and now they’re telling me to contact my bank about this issue. I’m absolutely baffled at the way a huge company like Nike treats their customers.",1,Bad,2020-08-01,2,Netherlands,customer service worst i’ve ever come across cancelled order € two months ago never received money back every time call tell something different first told i’d receive money within working days told never received payment that’s never paid sent proof payment they’re telling contact bank issue i’m absolutely baffled way huge company like nike treats customers,customer service worst i’ve…
Stefania Barilari,To whom may concern got a Bill for…,"To whom may concern got a Bill for €134.95 taken from my account , but I don’t know what I have bought can you enlight this situation",2,Poor,2020-08-01,1,United Kingdom,may concern got bill € taken account don’t know bought enlight situation,may concern got bill for…
Jorge DM,FUQQQQ NIKE I EVEN DELETED MY MEMBERS ACCOUNTA,Bruh so i had placed a custom hurache orders with a text saying anyway fuqyou and they tried teling me because of insufficient product in the warehouse they had to cancel my orders after three days passing by like wat daaa fuqqqqq is wrong with nike if y’all didn’t like the lettering why would your customization prt let me continue,1,Bad,2020-07-27,1,United States,bruh placed custom hurache orders text saying anyway fuqyou tried teling insufficient product warehouse cancel orders three days passing like wat daaa fuqqqqq wrong nike y’all didn’t like lettering would customization prt let continue,fuqqqq nike even deleted members accounta
Iva Gamache,Best sandals and running shoes,Been using Nikes for decades now and it's been a very solid brand.  I love their products especially their sandals and running shoes,4,Great,2020-07-21,3,Sweden,using nikes decades solid brand love products especially sandals running shoes,best sandals running shoes
Jiao J.,great lightweight shoes for the gym,,5,Excellent,2020-07-20,1,Canada,,great lightweight shoes gym
Jack,I ordered some shoes,"I ordered some shoes, very comfortable and cool looking. he website is really easy to navigate. Nike has amazing work out clothes and the quality is fantastic. I also love their shoes.",5,Excellent,2020-07-20,12,United States,ordered shoes comfortable cool looking website really easy navigate nike amazing work clothes quality fantastic also love shoes,ordered shoes
Erika donovan,Trainers came on time,Trainers came on time. Comfortable. Nice.,4,Great,2020-07-15,4,United Kingdom,trainers came time comfortable nice,trainers came time
Ms Abigail Fisher,Can't fault,Can't fault. Great delivery and amazing customer service.,5,Excellent,2020-07-15,108,United Kingdom,cant fault great delivery amazing customer service,cant fault
Rebecca B,Bought a customised football shirt for…,Bought a customised football shirt for my son from the Nike shop. Not overpriced like I thought it would be. Really pleased with it and it came so quickly! Would definitely buy from them again.,5,Excellent,2020-07-15,4,United Kingdom,bought customised football shirt son nike shop overpriced like thought would really pleased came quickly would definitely buy,bought customised football shirt for…
Luke Weber,amasing products,,5,Excellent,2020-07-13,4,Switzerland,,amasing products
Mariana Barona,Terrible Customer Service!!,"DO NOT BUY FROM NIKE. Atrocious customer service. I bought a pair of trainers and put the orange shoe box in my handbag on my way back home. The orange from the box stained my jacket and bag! When I went to Nike  in London to ask for compensation, and even reminding them of what the consumer law is, they basically just dismissed me and refused to give me any sort of compensation! 200 pounds in the bin....",1,Bad,2020-07-12,2,United Kingdom,buy nike atrocious customer service bought pair trainers put orange shoe box handbag way back home orange box stained jacket bag went nike london ask compensation even reminding consumer law basically dismissed refused give sort compensation pounds bin,terrible customer service
MissyElliot,Thank you for your work and services.,I love Nike. Thank you for your work and services. I liked my Nike Air Force a lot.,5,Excellent,2020-07-07,1,United Kingdom,love nike thank work services liked nike air force lot,thank work services
M. Merritt,My first sneakers,My first sneakers. So I really like it!,5,Excellent,2020-07-06,1,United States,first sneakers really like,first sneakers
kevin e,WASHINGTON REDSKINS MERCHANDISE,"LEARN YOUR HISTORY INSTEAD OF BEING SHEEP AND JUMPING ON BANDWAGON. CHANGED FROM THE BRAVES TO REDSKINS TO HONOR COACH AT THAT TIME. A SIOUX INDIAN NAMED WILLIAM “LONE STAR” DIETZ. OH THE TEAM ALSO HAD 6 NATIVE AMERICANS ON THAT ROSTER! In the early 1800s, the term “red-skin” was used by American Indian leaders to create a sense of “supra-tribal” identity when negotiating with the US Federal Government. It was intended to reference American Indian solidarity and unity, and to contrast these collected individuals with their “whiteskin” negotiating partners (e.g., the French, British, and former American colonists).",1,Bad,2020-07-03,2,United States,learn history instead sheep jumping bandwagon changed braves redskins honor coach time sioux indian named william “lone star” dietz oh team also native americans roster early term “redskin” used american indian leaders create sense “supratribal” identity negotiating us federal government intended reference american indian solidarity unity contrast collected individuals “whiteskin” negotiating partners eg french british former american colonists,washington redskins merchandise
Jordan,Love it a lot,Love it a lot. Best brand ever,5,Excellent,2020-07-02,1,United States,love lot best brand ever,love lot
Amalia,luv them,luv them! great company!,5,Excellent,2020-06-26,3,United States,luv great company,luv
Brianda Long,Nike CANCELLED My Order,"I purchased shoes (item #C00182993485), one week ago. I paid for it and was suppose to be getting them on Saturday the 27th.Out of the blue, Nike CANCELLED my purchased with NO explanation as to why on June 23rd.No message and no response from customer service.",1,Bad,2020-06-25,2,United States,purchased shoes item c one week ago paid suppose getting saturday thout blue nike cancelled purchased explanation june rdno message response customer service,nike cancelled order
Will,Cedric (Las Vegas office?) = 5+ stars,Cedric (Las Vegas office?) was the best representative I've talked to in customer service. Very dedicated to making sure that all issues are resolved and done so in a timely and flawless manner. Ced deserves more than 5 stars,5,Excellent,2020-06-24,1,United States,cedric las vegas office best representative ive talked customer service dedicated making sure issues resolved done timely flawless manner ced deserves stars,cedric las vegas office stars
Shafayet Rhaman Ayon Shafayet Ayon,Nike is the of prefer to high quality…,Nike is the of prefer to high quality product.. I'm satisfied with that.,5,Excellent,2020-06-24,6,Bangladesh,nike prefer high quality product im satisfied,nike prefer high quality…
Sean DaCosta,Nike raffle 5/29 on SNKRS App,"Won a raffle on 5/29 from SNKRs app from Nike. Product paid for, it wasnt free. It was shipped to the wrong address but was scheduled to get there 5/11. I would have been able to receive it as that was the date it would arrive. When I checked the order 5/10 it was on its way back to Nike as it was returned.I called Nike cx care 5/10 to see if it could be shipped back. Cx care told me the supervisor will receive the order and send it back to me at either the UPS place to hold it or the address I would like. They said Monday i will receive an email for the order and where it will be shipped which would take 7 days. I called on 5/13 to verify and they didn't see anything on my profile or notes. This agent said he would get it to me no problems. Still haven't heard from Nike.I called 5/20 and was informed that the shoes are not available and when i asked about my pair that was promised by a supervisor and the other 2 agents, where did that specific pair go. I was just told there isn't any available once again. Worst cx experience I've had. If I was told from the beginning I wouldn't be able to get it back i would understand but from the early shipping to the misinformation I was given multiple times. I cannot explain how disappointed and furious I am with Nike",1,Bad,2020-06-20,3,United States,raffle snkrs app nike product paid wasnt free shipped wrong address scheduled get would able receive date would arrive checked order way back nike returnedi called nike cx care see could shipped back cx care told supervisor receive order send back either ups place hold address would like said monday receive email order shipped would take days called verify didnt see anything profile notes agent said would get problems still havent heard nikei called informed shoes available asked pair promised supervisor agents specific pair go told isnt available worst cx experience ive told beginning wouldnt able get back would understand early shipping misinformation given multiple times cannot explain disappointed furious nike,nike raffle snkrs app
Customer737,Great range of products and sizes at…,Great range of products and sizes at good prices 💕💕,5,Excellent,2020-06-20,9,United Kingdom,great range products sizes good prices 💕💕,great range products sizes at…
