Reviewer,Title,Reviews,Star_rating,Rating,Date,Reviews_posted,Location,Reviews_clean,Title_clean
Nafiseh Fadayevatan,"Nike town London, The worst management ever",The worst management ever! Did not refund or even exchange a faulty per of shoes within its warranty time despite I had a bank statement as the proof of purchase. Insisted that you have to have the receipt!! Who keeps the receipt for one year expecting that the product going to fail???!!!! Very disappointed with the management ability and willingness to resolve customers’ problems!!,1,Bad,2020-03-15,1,United Kingdom,worst management ever refund even exchange faulty per shoes within warranty time despite bank statement proof purchase insisted receipt keeps receipt one year expecting product going fail disappointed management ability willingness resolve customers’ problems,nike town london worst management ever
Lorenzo,The prices are brilliant and I will…,The prices are brilliant and I will always go there. Plus they sponsor some of the worlds best tennis players.,5,Excellent,2020-03-12,35,United Kingdom,prices brilliant always go plus sponsor worlds best tennis players,prices brilliant will…
Timothy Alexander,Large assortment of all my favorite…,Large assortment of all my favorite nike shoes. Especially appreciate the limited editionShipping is kinda slow and customer service is not very helpful,3,Average,2020-03-09,7,United States,large assortment favorite nike shoes especially appreciate limited editionshipping kinda slow customer service helpful,large assortment favorite…
Daniel Masters,New trainers,My daughter loves her new trainers and I was so happy I managed to get them at a great price than other retailers.,4,Great,2020-03-09,5,United Kingdom,daughter loves new trainers happy managed get great price retailers,new trainers
Richard Aldrin,Great retail experience,,5,Excellent,2020-03-06,5,United Kingdom,,great retail experience
Brandon Beach,I love their sneaker selection.,,5,Excellent,2020-02-28,3,United States,,love sneaker selection
Bob Schlueter,great sb sneakers,,1,Bad,2020-02-22,4,United States,,great sb sneakers
anniemack55,not good,not good I don't like at all,1,Bad,2020-02-19,9,United States,good dont like,good
Ait Labadaoui Yassine,Nike is beautiful and a very high…,Nike is beautiful and a very high helmet. I love her very much,4,Great,2020-02-14,11,Morocco,nike beautiful high helmet love much,nike beautiful high…
Michael Dickens,I like Nike shoes,I like Nike shoes the most! The prices are sometimes way too high on the new collections but the quality is just amazing!,5,Excellent,2020-02-07,6,United States,like nike shoes prices sometimes way high new collections quality amazing,like nike shoes
R Roberts,"Terrible service, dysfunctional internal processes","Terrible service, some of the worst i've experienced:- Ordered online, got an error code so called telephone number given - goes through to their Irish call centre. Employee takes order over the phone - trainers for my wife's birthday. Several days later I realised nothing arrived, checked Nike account & realise order cancelled without telling me! I call them - apparently it's policy not to tell people when orders cancelled! Now too late to get trainers for birthday... and there is still a debit of -£239 on my bank account. Bank says I cannot get money released without something in writing from Nike to say that the order will not be fulfilled. I call Irish call centre again. Employee this time says it is not possible to get email confirming they won't send shoes.. after some argument, she says an email will have to be sent by their 'email team' (Isn't she sitting in front of a computer). I say ok... several days later, still no email from the email team, money is still showing as debit on my bank account and no refund.. I will have to call their woeful call centre again. Really unbelievable that such a large company has such awful processes. Avoid - go to a third party retailer.",1,Bad,2020-02-04,2,United Kingdom,terrible service worst ive experienced ordered online got error code called telephone number given goes irish call centre employee takes order phone trainers wifes birthday several days later realised nothing arrived checked nike account realise order cancelled without telling call apparently policy tell people orders cancelled late get trainers birthday still debit £ bank account bank says cannot get money released without something writing nike say order fulfilled call irish call centre employee time says possible get email confirming wont send shoes argument says email sent email team isnt sitting front computer say ok several days later still email email team money still showing debit bank account refund call woeful call centre really unbelievable large company awful processes avoid go third party retailer,terrible service dysfunctional internal processes
David Lloyd,Do not order online I didn't receive my…,Do not order online I didn't receive my item it took 3 weeks of waiting for them to tell me I'm not going to receive my item and that they will refund me so upsetting,1,Bad,2020-01-17,4,United Kingdom,order online didnt receive item took weeks waiting tell im going receive item refund upsetting,order online didnt receive my…
Misty lindsay,Nike is okay,"Nike is okay, I like the products just not the prices.",3,Average,2020-01-14,2,United States,nike okay like products prices,nike okay
Spencer,Shop local,"Nike products still rule, their store prices are comical though. Try your local sporting goods store.",1,Bad,2020-01-14,9,United States,nike products still rule store prices comical though try local sporting goods store,shop local
Paul Martson,Incredible awesome as always :),,5,Excellent,2020-01-11,1,United States,,incredible awesome always
Hen_Kaya,"It's bad, just awful.","I don't have to do much to know when a website is bad. I tried to buy one article and the website keeps giving me an error like i'm supposed to know what that is. I thought maybe it's the browser, sometimes it happens, but no, it wasn't.I also thought, well, i'll try tomorrow. Still nothing. Isn't it funny how i can't say anything good about it?This is next level incompetence, and from a big company like Nike nevertheless, it's mind boggling how proud they are of having a trash website.I can't even make one simple purchase, i tried everything. My first experience with Nike was just awful.",1,Bad,2019-12-14,3,Portugal,dont much know website bad tried buy one article website keeps giving error like im supposed know thought maybe browser sometimes happens wasnti also thought well ill try tomorrow still nothing isnt funny cant say anything good itthis next level incompetence big company like nike nevertheless mind boggling proud trash websitei cant even make one simple purchase tried everything first experience nike awful,bad awful
Michelle Orr,Paid €70 to nikestore.com for Nike…where’s my money/shoes,Paid €70 to nikestore.com for Nike teckno trainers but got no order number or any emails regarding this purchase.Money has gone but no sign of the shoes.UPDATE Nike customer service just sorted the problem.Thanks to jeanroland,5,Excellent,2019-12-12,3,Ireland,paid € nikestorecom nike teckno trainers got order number emails regarding purchasemoney gone sign shoesupdate nike customer service sorted problemthanks jeanroland,paid € nikestorecom nike…where’s moneyshoes
Tom Parle,Terrible service from this huge company…,"Terrible service from this huge company who should know better. Ordered some trainers in the Black Friday sales - they then hung on to my order until the sales were over only to tell me that, although their website stated my size was in stock, they didn't have them in stock and that their website does not always truly reflect the reality of what items they have in their warehouse. All the other sites I could have ordered the same shoes from are now out of stock so I lost out due to very poor inventory management from Nike.com. I have never had this problem shopping elsewhere - other big companies such as Amazon are able to get the basics of online shopping in place to ensure the experience for the customer gives them confidence to return in the future. I will not be shopping at Nike.com anymore as it is too risky.",1,Bad,2019-12-06,2,United Kingdom,terrible service huge company know better ordered trainers black friday sales hung order sales tell although website stated size stock didnt stock website always truly reflect reality items warehouse sites could ordered shoes stock lost due poor inventory management nikecom never problem shopping elsewhere big companies amazon able get basics online shopping place ensure experience customer gives confidence return future shopping nikecom anymore risky,terrible service huge company…
Innovation Designs,Great products,,5,Excellent,2019-11-28,2,United Kingdom,,great products
Artem,Can't refund my order from Nike online order,"Ordered Nike online while being in the UAE. Was concerned about the return but Nike assured me that I have plenty of time to make a free return and it would be very easy in case my order doesn't fit.Order arrived, it didn't fit, I issued a return on the website. The delivery guy didn't come on the expected date and 3 days already have passed. Nike.com customer support told me that they can't do anything about it since the purchase was made outside of the US. They gave me 2 phone numbers, a toll-free one that doesn't exist and a local UAE one that belongs to a partner SunAndSandSports. I reached those guys, and guess what? I can't get a refund for my order! Only exchange is possible and ""they are doing that only because I'm a Nike client""...So here I am, trying to exchange the order that didn't fit to something else instead of getting my money back. This is the first and the last time I ordered something on Nike.com. Moreover, I am very upset with the customer service at Nike. Definitely do not recommend anyone to order online!!!",1,Bad,2019-11-24,2,U.A.E.,ordered nike online uae concerned return nike assured plenty time make free return would easy case order doesnt fitorder arrived didnt fit issued return website delivery guy didnt come expected date days already passed nikecom customer support told cant anything since purchase made outside us gave phone numbers tollfree one doesnt exist local uae one belongs partner sunandsandsports reached guys guess cant get refund order exchange possible im nike clientso trying exchange order didnt fit something else instead getting money back first last time ordered something nikecom moreover upset customer service nike definitely recommend anyone order online,cant refund order nike online order
Imran,Woeful customer service,"NikePlus app indicates stock is available, with no ability to reserve in store (NikeTown). On two occasions, I have visited the store (at a cost of £70) to buy a particular product, when the store opened. Lo and behold the product is not available. The staff couldn't care less, and say it's a problem with the App and the digital part of the business and escalate with them. When escalated with Nike Customer Services, they have not come back with a satisfactory response in over a month and now choose to ignore my emails. Great products but awful customer service. I have lost faith in NikeTown and Nikestore.",1,Bad,2019-11-01,6,United Kingdom,nikeplus app indicates stock available ability reserve store niketown two occasions visited store cost £ buy particular product store opened lo behold product available staff couldnt care less say problem app digital part business escalate escalated nike customer services come back satisfactory response month choose ignore emails great products awful customer service lost faith niketown nikestore,woeful customer service
alison Bryant,I tried twice to order a gift card for…,"I tried twice to order a gift card for my Godson from the French Nike site - and paid. The first time they took my money and then (for no reason) reimbursed it without sending the ""carte cadeaux"". The second time they took my money, failed to deliver and even after 3 hours on the telephone and 5 emails, have failed to reimburse me!Each time I call (and I do speak fluent French) they are incapable of finding my order, finding my emails, finding my order number - even finding my email address.DON'T PLACE AN ORDER HERE.",1,Bad,2019-10-30,3,United Kingdom,tried twice order gift card godson french nike site paid first time took money reason reimbursed without sending carte cadeaux second time took money failed deliver even hours telephone emails failed reimburse meeach time call speak fluent french incapable finding order finding emails finding order number even finding email addressdont place order,tried twice order gift card for…
Mo Ali,Formidabel service og ekseptionelle…,Formidabel service og ekseptionelle produkter,5,Excellent,2019-10-05,3,Denmark,formidabel service og ekseptionelle produkter,formidabel service og ekseptionelle…
Emre,Awesome,"Awesome site to shop,plenty of products.",5,Excellent,2019-10-04,145,Turkey,awesome site shopplenty products,awesome
danny luke,Nike offers footwear not just among…,Nike offers footwear not just among athlete but to all kinds of individual. It's reasonable price and good product quality is what made it interesting to the buyers. I have been a Nike user since then and I would say that it is very wise of an individual to choose this brand of footwear.,5,Excellent,2019-09-12,3,Philippines,nike offers footwear among athlete kinds individual reasonable price good product quality made interesting buyers nike user since would say wise individual choose brand footwear,nike offers footwear among…
YG K,"(Nike.nl) No benefit of shopping here, only disadvantages!","About my purchase on Nike.nlI have used a voucher code (was a gift to me) to purchase an item from nike online store. they are promoting this 30 day return policy but stay warned that if you do return the item, it might take about 3-4 weeks before you get refunded. Well, in my case, since i used a voucher, i by definition have to wait for that to repurchase an item again, in the meanwhile i miss out on all promotions or stocks of whatever i might be interested in. The chat assistant also was arrogant (Nick: Rubert) and just copy paste some standard sentences and he just ended the chat before i had finished with my feedback. At this point i don't even know what the outcome of the process will be. I have shopped online in the Netherlands tens of times for anything, and even in the smallest business, refund process goes faster and smoother. Avoid using Nike online store in my opinion, hardly the cheapest prices, never as much variety as you can find elsewhere (even on Nike items), and not a visible advantage that i can see buying from the brand's own online store either apparently.",2,Poor,2019-09-05,1,Netherlands,purchase nikenli used voucher code gift purchase item nike online store promoting day return policy stay warned return item might take weeks get refunded well case since used voucher definition wait repurchase item meanwhile miss promotions stocks whatever might interested chat assistant also arrogant nick rubert copy paste standard sentences ended chat finished feedback point dont even know outcome process shopped online netherlands tens times anything even smallest business refund process goes faster smoother avoid using nike online store opinion hardly cheapest prices never much variety find elsewhere even nike items visible advantage see buying brands online store either apparently,nikenl benefit shopping disadvantages
Martin Kyst,Very bad experience,Very bad experience. I bought an expensive pair of running shoes in the Nike Store in Lisbon on my holiday. Three weeks later the sole broke apart after only having been used 6-7 times. I contacted Nikestore online but they would not refund me or send a new pair. They just told me to contact the shop in Portugal. I live in Denmark and consequently that is not a viable option. I cannot understand how a world famous brand can accept such a bad consumer experience. Last time I buy a Nike product!,1,Bad,2019-08-20,12,Denmark,bad experience bought expensive pair running shoes nike store lisbon holiday three weeks later sole broke apart used times contacted nikestore online would refund send new pair told contact shop portugal live denmark consequently viable option cannot understand world famous brand accept bad consumer experience last time buy nike product,bad experience
Briana Johns,Cancelled my order when it already gave…,"Cancelled my order when it already gave me an arrival date. On the day it was supoose to be delivered they said it was out of stock. My son waited Over a week to get this bookbag. Even used a old bookbag because he really wanted this one. One rep ended our online conversation because I asked for a number to reach a leadership member, then I called in, they couldn't have cared less. Smh!",1,Bad,2019-08-07,1,United States,cancelled order already gave arrival date day supoose delivered said stock son waited week get bookbag even used old bookbag really wanted one one rep ended online conversation asked number reach leadership member called couldnt cared less smh,cancelled order already gave…
emma Carter,Have been waiting for my little boys…,"Have been waiting for my little boys football kit for a couple of weeks, logged to see the status and it’s been cancelled, no warning, no apology no communication at all. Called customer complaints, the attitude was, yes that happens sometimes. Thanks Nike, I now have to explain to my child why his football kit isn’t coming. Appalling.",1,Bad,2019-07-29,5,United Kingdom,waiting little boys football kit couple weeks logged see status it’s cancelled warning apology communication called customer complaints attitude yes happens sometimes thanks nike explain child football kit isn’t coming appalling,waiting little boys…
David Goulden,No communication no response to Emails…,"No communication no response to Emails NO CUSTOMER CARE WHAT SO EVER !!!!!!!!!!Ca,nt cancel my order, have not received my order, cannot contact them NEVER AGAIN  AND £12.00 DELIVERY FOR A PAIR OF SHORTS !!!!!Dave Goulden",1,Bad,2019-07-10,3,United Kingdom,communication response emails customer care ever cant cancel order received order cannot contact never £ delivery pair shorts dave goulden,communication response emails…
Clotaire,Worst shipping,If you are looking to order from the Nike site make sure to give yourself 2 weeks to a month of waiting time and absolutely do not pay for their express shipping its a joke and a waist of money.,1,Bad,2019-06-28,1,U.A.E.,looking order nike site make sure give weeks month waiting time absolutely pay express shipping joke waist money,worst shipping
Andrea Martins,"I paid for fast delivery and not only it wasn't fast, but it also never happened.","I paid for fast delivery, and the delivery never came. I contacte the store twice via email and never got a reply. Then I contacted the store through the customer chat, and the guy said he doesn't know why it hasn't been delivered yet and that we would contact me when he had an answer. I'm still waiting...",1,Bad,2019-06-19,2,Germany,paid fast delivery delivery never came contacte store twice via email never got reply contacted store customer chat guy said doesnt know hasnt delivered yet would contact answer im still waiting,paid fast delivery wasnt fast also never happened
Mandy,Infant white rift shoes - avoid!,"Bought white rift trainers for my 16mth old grandaughter from office uk, reviewing them too! Kids play & get dirty, these shoes come with no cleaning care instructons so they have been wiped down with a clean cloth & a touch of fairy non-bio, they are ruined, will not come clean, £40 down the drain. Why sell non-cleaning white shoes for infants? I think maybe my 3 adult men will avoid nike (and office) at all cost. Kids play, nike need to know that white mesh cloth shoes get dirty!",1,Bad,2019-06-19,23,United Kingdom,bought white rift trainers mth old grandaughter office uk reviewing kids play get dirty shoes come cleaning care instructons wiped clean cloth touch fairy nonbio ruined come clean £ drain sell noncleaning white shoes infants think maybe adult men avoid nike office cost kids play nike need know white mesh cloth shoes get dirty,infant white rift shoes avoid
Suze,Dispicable quality and even worse customer service,"Dispicable quality and even worse customer serviceI have received not one but two pairs of misshapen poor quality Cortez shoes, yet Nike maintain they are a really great shoe, it’s laughable, apparently the images were sent to a special team who could not see any defects, it is beyond belief.Really? Two pairs of the same style of shoe received all bent out of shape?Nike know they are of dreadful quality but will do absolutely nothing about it.I am absolutely disgusted with there attitude and complete lack of customer service",1,Bad,2019-05-06,24,United Kingdom,dispicable quality even worse customer servicei received one two pairs misshapen poor quality cortez shoes yet nike maintain really great shoe it’s laughable apparently images sent special team could see defects beyond beliefreally two pairs style shoe received bent shapenike know dreadful quality absolutely nothing iti absolutely disgusted attitude complete lack customer service,dispicable quality even worse customer service
Terese Kerrigan,Just do it,Just do it. Great product and company.,5,Excellent,2019-02-19,1,United States,great product company,
Duc Bui,Ashamed Payment System,"Can't purchase anything from Nike at all. Always got error code 9E10658B for some reason, even after changing multiple debit card or devices.",1,Bad,2019-02-11,8,United Kingdom,cant purchase anything nike always got error code eb reason even changing multiple debit card devices,ashamed payment system
Josh,"Oh gosh where to start, sort your life out Nike","Oh gosh where to start, 3 months, as many clothes orders. None of which were small orders. EVERY order atleast 2 items sent back due to the quality of the material (bobbling when washed within 2 weeks) or just the items were constructed badly. Also ordered trainers, and returned them before i even got them, as UPS doesnt know how to ring when unsure of location, and i wasnt in the mood to sit in all day again because UPS dont do delivery estimated times. Nike your ONLY saving grace is the customer services. Very friendly and helpful. Oh and i needed to exchange one item due to shoddly put together by one of nikes obscure location factorys (no arm hole elastic, arms too long and main body cut dodgy), sent the thing back YOU had it a week and ended up having to call customer services who couldnt understand why it hadnt been sent. Actually afraid to order anything online from nike now, cause of the agro attached!!!!",2,Poor,2019-01-24,18,United Kingdom,oh gosh start months many clothes orders none small orders every order atleast items sent back due quality material bobbling washed within weeks items constructed badly also ordered trainers returned even got ups doesnt know ring unsure location wasnt mood sit day ups dont delivery estimated times nike saving grace customer services friendly helpful oh needed exchange one item due shoddly put together one nikes obscure location factorys arm hole elastic arms long main body cut dodgy sent thing back week ended call customer services couldnt understand hadnt sent actually afraid order anything online nike cause agro attached,oh gosh start sort life nike
jerald harvey,wowwww....,wowwww..... i'm just loving the brand... i lov the fashion and their services as welll.... i love their style...,4,Great,2019-01-08,2,United States,wowwww im loving brand lov fashion services welll love style,wowwww
Josh,Whats happened to nikes quality,"Ive been a long time nike customer, for more years then i care to remember. So when it came time for a shopping spree dont need to guess where i went, along with the vast sums ive spent over the years. I bought some jogging bottoms and simular hoody, well 3 sets, of diffrent types/styles along with other things. All of a couple weeks of use and washing and the things are bobbled. The tshirts, boxers and even sox are perfectly fine. Also the quality an feel of the items is now dire, ive still got a zip hoody from 2 years ago (thats hasnt bobbled) feels much more substantal, thicker and overall better quality. WHAT HAVE YOU DONE NIKE. Arnt companys ment to get better quality wise over time? The worst bit is you cant even email anyone to air your complaints, no email, phone lines are constantly busy. Luckly managed to speak to a lovely lady, who sorted the refund straight away, said she would speak to the higher ups about quality, heres hoping",1,Bad,2019-01-08,3,United Kingdom,ive long time nike customer years care remember came time shopping spree dont need guess went along vast sums ive spent years bought jogging bottoms simular hoody well sets diffrent typesstyles along things couple weeks use washing things bobbled tshirts boxers even sox perfectly fine also quality feel items dire ive still got zip hoody years ago thats hasnt bobbled feels much substantal thicker overall better quality done nike arnt companys ment get better quality wise time worst bit cant even email anyone air complaints email phone lines constantly busy luckly managed speak lovely lady sorted refund straight away said would speak higher ups quality heres hoping,whats happened nikes quality
Catherine Wilkinson,Super fast delivery,Super fast delivery - ordered Thursday and they arrived Saturday.  Will use again.,5,Excellent,2019-01-06,6,United Kingdom,super fast delivery ordered thursday arrived saturday use,super fast delivery
