Reviewer,Title,Reviews,Star_rating,Rating,Date,Reviews_posted,Location,Reviews_clean,Title_clean
Lisa Stammer,Easy website,"Easy website, fast shipping,  wonderful customer service.  Great experience",4,Great,2020-12-29,5,United States,easy website fast shipping wonderful customer service great experience,easy website
sharon richards,Hey Merry Christmas Nike!!,Hey Merry Christmas Nike!!Delivery scheduled for 22nd ha ha!!Still not with DPD as goods being sent from Belgium - so I would hazard a guess at them being sat in some port now not able to come to the UK!!No communications - except I will issue a refund- errr no thanks I want the goods I have purchased- that you have the funds for !!,1,Bad,2020-12-23,2,United Kingdom,hey merry christmas nikedelivery scheduled nd ha hastill dpd goods sent belgium would hazard guess sat port able come ukno communications except issue refund errr thanks want goods purchased funds,hey merry christmas nike
jason,Nike along with apple and coca cola supporting slavery in china,"""I read in the New York Times that Nike is fighting the passage of the Uighur Forced Labor Prevention Act, a bill that would ensure that forced Uighur labor isn't used in the making of parts you buy. That's gross, and I will absolutely stop buying your products if you continue to obstruct the bill's passage. Please pass this message along to leadership. Thanks.""",1,Bad,2020-12-22,3,United States,read new york times nike fighting passage uighur forced labor prevention act bill would ensure forced uighur labor isnt used making parts buy thats gross absolutely stop buying products continue obstruct bills passage please pass message along leadership thanks,nike along apple coca cola supporting slavery china
Ted Hollar,Ordered some shoes the 16th SAME day I…,Ordered some shoes the 16th SAME day I ordered from Adidas... Dec 16th I made my order... Recieved my Adidas the 20th already... SAME DAY I ordered the Nikes my suggested delivery date was Dec. 30th... Then today Dec. 22 I get a email saying it might be delayed more! With that being said... Being the bigger company... WHAT EXACTLY IS THE HOLD UP!?! How can one company fill my order and have it shipped and to my house before y'all even fill my order... I don't think I wanna order from Nike ever again...,1,Bad,2020-12-22,2,United States,ordered shoes th day ordered adidas dec th made order recieved adidas th already day ordered nikes suggested delivery date dec th today dec get email saying might delayed said bigger company exactly hold one company fill order shipped house yall even fill order dont think wanna order nike ever,ordered shoes th day i…
Charles Nelson,bad service but good product,,1,Bad,2020-12-21,1,United Kingdom,,bad service good product
Craig Mathews,nice products,,3,Average,2020-12-21,1,United Kingdom,,nice products
Grotto Tichino,free running,"free running, superweicher sneaker",4,Great,2020-12-20,5,Switzerland,free running superweicher sneaker,free running
Dianne,Awful service,"Awful service - ordered and paid for personalised football kits online,  nike cancelled order due ti stock but failed to inform me so I could shop elsewhere.  Only when I called for an update on delivery did nike inform me some 9 days after placing the order.",1,Bad,2020-12-18,5,United Kingdom,awful service ordered paid personalised football kits online nike cancelled order due ti stock failed inform could shop elsewhere called update delivery nike inform days placing order,awful service
BroskiBerry,Worst experience ever,"Paying top money for a tracksuit, it rips in under a month and you label this as ""wear and tear""? Get lost scammers!",1,Bad,2020-12-16,8,Germany,paying top money tracksuit rips month label wear tear get lost scammers,worst experience ever
LambOfDog,Exploiting children for profit,"Cheap clothes made by cheap labor exploited children, and you want to charge 60€ + for them? Get real.",2,Poor,2020-12-07,9,Germany,cheap clothes made cheap labor exploited children want charge € get real,exploiting children profit
Jay Jay,Didn't recieve my order - heard nothing back from Nike,,1,Bad,2020-12-06,50,United Kingdom,,didnt recieve order heard nothing back nike
Jonathan Smith,Slow speeds?,Maybe it’s just me but the website has a slow speed.,3,Average,2020-12-05,1,United States,maybe it’s website slow speed,slow speeds
Josh C.,The best for me,The best for me! I would like to purchase new set of Air Jordan 1.,4,Great,2020-12-03,14,United States,best would like purchase new set air jordan,best
Ethan Gutmann,Online sucks,Order my sneakers online. Took them forever to arrive. Finally when it got me it's the wrong size. For heaven's sake! No system in place I guess or just the pandemic? Whatever it is.. 1 star for bad service.,1,Bad,2020-12-02,2,United States,order sneakers online took forever arrive finally got wrong size heavens sake system place guess pandemic whatever star bad service,online sucks
Alin Rosca,I've ordered some Jordans from Nike.com…,"I've ordered some Jordans from Nike.com on 30th September and my order got stuck in their NL Warehouse since then. In last month I've spoken every week with the customer support department, each agent told me the same story, that their finance department has to approve the request and they have to answer in 5-7 working days. Even if every time I call them, they can see that those days have passed several times, they just add a comment to that case and nothing is happening.I should read more carefully all other reviews about how Nike doesn't give a s**t about customers.",1,Bad,2020-12-01,5,United Kingdom,ive ordered jordans nikecom th september order got stuck nl warehouse since last month ive spoken every week customer support department agent told story finance department approve request answer working days even every time call see days passed several times add comment case nothing happeningi read carefully reviews nike doesnt give st customers,ive ordered jordans nikecom…
Soliel DeBella,I placed an order with Nike,"I placed an order with Nike, a very expensive one with customized shoes. After I placed the order I realized the computer changed my shoelace choice. I could easily buy my own and I did, but for $180 I went back in and it said I could look or modify the order...um, nope. you can't. I did the whole chat, totally useless, after waiting and talking about this and that, only to be told, ""only I can see the order, they cant' do anything on their end."" okay fine, I call...after waiting and being placed on hold three tiems, I was told the exact same thing. Mind you, this is an order placed within the half hour. You are telling me you can't modify my shoe lace choice for almost $200 pair of shoes that have yet to come close to be worked on? all I can say, is don't mess up and don't expect ""customer service' to do ANYTHING for you. If they can't even see your order or modify it, and anything you do you are told to cancel the order, wait and retry, you don't even need to pay them, just be honest on the site and not waste our time.",1,Bad,2020-12-01,1,United States,placed order nike expensive one customized shoes placed order realized computer changed shoelace choice could easily buy went back said could look modify orderum nope cant whole chat totally useless waiting talking told see order cant anything end okay fine callafter waiting placed hold three tiems told exact thing mind order placed within half hour telling cant modify shoe lace choice almost pair shoes yet come close worked say dont mess dont expect customer service anything cant even see order modify anything told cancel order wait retry dont even need pay honest site waste time,placed order nike
Martin Lopez,Nike Cheats People,"Nike customer service is rude, not sincere and tossed me around from one person to another. Ordered a couple of things on 11.11. Bank Transaction done. A week later i checked my account and saw that it was empty. Got in touch with customer service and she said transaction not found. Sent her copy of my bank statement that shows clearly Nike with the amount. Its no small amount. She keeps telling me she's sent proof of no transaction on nikes part. But the email has no attachment at all. This is the first online purchase from Nike from me and it will be the last. Nike is a big cheat. Stick with Adidas, puma and under armour. They have more class.",1,Bad,2020-11-30,1,Malaysia,nike customer service rude sincere tossed around one person another ordered couple things bank transaction done week later checked account saw empty got touch customer service said transaction found sent copy bank statement shows clearly nike amount small amount keeps telling shes sent proof transaction nikes part email attachment first online purchase nike last nike big cheat stick adidas puma armour class,nike cheats people
arnie,Nike is the best,Nike is the best. shoes and apparel are high quality. been collecting cortez.,5,Excellent,2020-11-29,8,Philippines,nike best shoes apparel high quality collecting cortez,nike best
Mary Young,I always try to purchase Nike shoes and…,"I always try to purchase Nike shoes and athletic apparel. I am impressed by their quality and the variety of what Nike offers. Also, their prices are reasonable, and periodically you can catch items on sale.",5,Excellent,2020-11-29,1,United States,always try purchase nike shoes athletic apparel impressed quality variety nike offers also prices reasonable periodically catch items sale,always try purchase nike shoes and…
David Craft,The shoes are comfortable while looting…,The shoes are comfortable while looting and peaceful protesting conditions are favorable.Thanks Nike to help make America great again.,5,Excellent,2020-11-24,23,United States,shoes comfortable looting peaceful protesting conditions favorablethanks nike help make america great,shoes comfortable looting…
lorraine markey,I Have waited 14 days for a refund and…,I Have waited 14 days for a refund and contacted them twice and just been fobbed off will never use this site again and neither will my whole family there  is no way it should take this long for a refund and i am still waiting terrible service,1,Bad,2020-11-23,3,United Kingdom,waited days refund contacted twice fobbed never use site neither whole family way take long refund still waiting terrible service,waited days refund and…
Helena Mackint,Socialist and Communist Sponsors,"I want to return all my Nike products and I will NEVER EVER Buy Nike in my life. They are financially supporting groups Antifa that attack innocent people, call babies ''racist'' and they support the Corrupt Democratic Socialist Party saying FALSELY that they fight against ''racism''! You cannot fight racism by sponsoring one of the MOST racist and socialist party in the world: The Democratic Party. Good luck with having clients ONLY the celebs, Elites, Billionaires and their fans! I am OUT and Done with NIKE!",1,Bad,2020-11-21,2,United States,want return nike products never ever buy nike life financially supporting groups antifa attack innocent people call babies racist support corrupt democratic socialist party saying falsely fight racism cannot fight racism sponsoring one racist socialist party world democratic party good luck clients celebs elites billionaires fans done nike,socialist communist sponsors
Dost,BAD CUSTOMER SERVICE,"I placed an order 2 months ago. I did not receive the order so i contacted them at least 4 times. They told me that the will look at this and let me know. I did not receive any feedback from them, i had to contact them every time again. Still no answer and today they told me they cancelled my order. The app shows it is being packed, they have not communicated this to me everytime i had contact and now they tell me to just reorder. My item was on sale and it was a very good deal, now i have to purchase another item which is at least 3 times the price. VERY BAD CUSTOMER SERVICE!!!!!!!!!!!!!!!!",1,Bad,2020-11-19,4,Netherlands,placed order months ago receive order contacted least times told look let know receive feedback contact every time still answer today told cancelled order app shows packed communicated everytime contact tell reorder item sale good deal purchase another item least times price bad customer service,bad customer service
Chris Hartman,Nice shoes and very comfortable,,4,Great,2020-11-16,1,United States,,nice shoes comfortable
Suzana Curavic,My favorite brand of trainers with amazing online shop!,"My favorite brand of trainers with the very neat website and absolutely amazing, capable and friendly customer service - everything is resolved quickly, also delivery, returns and refunds are quick and easy. It's always a pleasure to shop with Nike!",5,Excellent,2020-11-14,4,Croatia,favorite brand trainers neat website absolutely amazing capable friendly customer service everything resolved quickly also delivery returns refunds quick easy always pleasure shop nike,favorite brand trainers amazing online shop
Ethan Abraham,I buy all my shoes from nike online…,I buy all my shoes from nike online store since the design option is awesome. All my nikes are designed by me. It is the coolest feature of nike online store. Other than that production and shipment takes at least 3 weeks even though it says at most 3 weeks in the website.,5,Excellent,2020-11-13,2,United States,buy shoes nike online store since design option awesome nikes designed coolest feature nike online store production shipment takes least weeks even though says weeks website,buy shoes nike online…
James Obrien,Nice and comfortable shoes,,3,Average,2020-11-13,1,United States,,nice comfortable shoes
Robert Skinner,Nice shoes and comfortable to wear,,3,Average,2020-11-13,1,United States,,nice shoes comfortable wear
RO,Awful,"Awful. Cannot order! Website is slow and when, finally, I gt to the basket i get an error message. Called Customer Service - after waiting for about 10 minutes got cut off, twice! Then got through to someone and... got cut off again! Finally spoke to someone and tehy tried to put the order through but could not. So, if you want to spend a couple of hours trying to do something that isn't possible due to the website problems, then go to nike.com ad waste your time for no reason. Only reason I am there and not Addidas is someone got me a voucher!",1,Bad,2020-11-11,2,United Kingdom,awful cannot order website slow finally gt basket get error message called customer service waiting minutes got cut twice got someone got cut finally spoke someone tehy tried put order could want spend couple hours trying something isnt possible due website problems go nikecom ad waste time reason reason addidas someone got voucher,awful
Roy Hale,I love the products here,,5,Excellent,2020-11-11,2,United States,,love products
SmokeWeedle,Expensive for what it offers,"While Nike has some really good looking clothes, mostly sportswear, the price is a bit too steep for today's market offer",3,Average,2020-11-09,8,Netherlands,nike really good looking clothes mostly sportswear price bit steep todays market offer,expensive offers
Oliva Jones,Good store and fast shipping,,5,Excellent,2020-11-08,4,United States,,good store fast shipping
Lambert Butler,am very happy i got my lovely shoes i…,am very happy i got my lovely shoes i ordered .,3,Average,2020-11-05,1,Cameroon,happy got lovely shoes ordered,happy got lovely shoes i…
Johan Rivera,Favorite brand on Earth,"I'm a little salty because like many of you, I miss out on alot of the coveted drops on the SNKRS app but I've also won my fair share of heat (coveted sneakers for the uninitiated) so you win some lose some. The shipping is almost always fast and quick (only complaint is slapping the nike logo on my shipping box, putting a bullseye on it for thieves). I've had to return items and also have had a quick and painless ordeal. The clearance section is decent, especially when they have the extra % off every few months or so. Nike is a a multi billion dollar company and they certainly act like it.",5,Excellent,2020-11-01,27,United States,im little salty like many miss alot coveted drops snkrs app ive also fair share heat coveted sneakers uninitiated win lose shipping almost always fast quick complaint slapping nike logo shipping box putting bullseye thieves ive return items also quick painless ordeal clearance section decent especially extra every months nike multi billion dollar company certainly act like,favorite brand earth
Lili,I like so much my new nikes,,4,Great,2020-10-29,3,France,,like much new nikes
Brian Jackson,Really good online shopping,,5,Excellent,2020-10-28,6,United States,,really good online shopping
Shaldon SA_ FH_LAGACY,Nike has been a trusted brand and I…,Nike has been a trusted brand and I have only good memories wearing Nike and wil continue wearing Nike til iam old and great. Keep up the good work Nike team.,5,Excellent,2020-10-27,4,South Africa,nike trusted brand good memories wearing nike wil continue wearing nike til iam old great keep good work nike team,nike trusted brand i…
David Seals,Nice and comfortable shoes.,,4,Great,2020-10-27,3,United States,,nice comfortable shoes
Danny Rivera,One of the best stores easy to check…,One of the best stores easy to check out some good quality shoes,5,Excellent,2020-10-26,1,United States,one best stores easy check good quality shoes,one best stores easy check…
Alan Zink,Comfortable to wear,,3,Average,2020-10-26,3,United States,,comfortable wear
Claude Dones,Very good shoes I like it very much,,4,Great,2020-10-26,3,United States,,good shoes like much
Mike,"Really Bad cutomer services,will never…","Really Bad cutomer services,will never come again",1,Bad,2020-10-23,2,Hong Kong,really bad cutomer serviceswill never come,really bad cutomer serviceswill never…
Palciana Colon,Love everything that has to do with a…,Love everything that has to do with a Nike Brand! It’s Amazing,5,Excellent,2020-10-23,1,United States,love everything nike brand it’s amazing,love everything a…
Emil Michalak,Fantastic experience with the Running…,Fantastic experience with the Running Shoes,5,Excellent,2020-10-21,2,Poland,fantastic experience running shoes,fantastic experience running…
Laura Choyce,Would recommend,"Ordered from Nike quite a few times for my Husband, dispatch can be very slow at times, but delivery after that is quick! Great prices when they have sales/offers! I’ve returned one pair of trainers, it was easy enough and my refund was with me well within the given time scale! No issues as others appear to be dealing with.",5,Excellent,2020-10-20,19,United Kingdom,ordered nike quite times husband dispatch slow times delivery quick great prices salesoffers i’ve returned one pair trainers easy enough refund well within given time scale issues others appear dealing,would recommend
Thomas Jørner,Poor Quality - Customize Nike shoes,"Almost unused customize Nike shoes - poor quality.The sole is crumbled after limited use.After 1 hour of telephone contact with customer services, Nike has not been able to decide to correct the error.Great disappointment",1,Bad,2020-10-19,13,Denmark,almost unused customize nike shoes poor qualitythe sole crumbled limited useafter hour telephone contact customer services nike able decide correct errorgreat disappointment,poor quality customize nike shoes
Kathleen S,Love my Nike air max,"Love my Nike air max, the best quality, comfort & design",5,Excellent,2020-10-19,2,United States,love nike air max best quality comfort design,love nike air max
Lucas Scott,not good,"well, the Nike online store is sucks",3,Average,2020-10-16,1,United States,well nike online store sucks,good
Russel Blanton,Good quality shoes,Good quality shoes. I'm ssatisfied with their products.,4,Great,2020-10-16,3,France,good quality shoes im ssatisfied products,good quality shoes
Idella Friesen,A brand you can wear with confidence.,,5,Excellent,2020-10-15,3,Australia,,brand wear confidence
Keith Lee,Nike customer service used to be…,"Nike customer service used to be something I bragged and raved about. Lately, I tell people if they want to know how NOT to run a customer service just call Nike or try to get a refund processed. Unresponsive, calls to people who rinse and repeats the same info you ALREADY knew ie “let’s see sir, I can see here u placed ur order on 8th Oct, you then called us on 9th Oct, blah blah and to conclude it usually takes “insert # working day’s” to get your shoes or refund. Thanks for nothing. Absolutely a disgrace. Pray ur item comes in good condition and in the right size, otherwise don’t even bother returning. Amazing how things can change overnight. S",1,Bad,2020-10-14,1,Malaysia,nike customer service used something bragged raved lately tell people want know run customer service call nike try get refund processed unresponsive calls people rinse repeats info already knew ie “let’s see sir see u placed ur order th oct called us th oct blah blah conclude usually takes “insert working day’s” get shoes refund thanks nothing absolutely disgrace pray ur item comes good condition right size otherwise don’t even bother returning amazing things change overnight,nike customer service used be…
Karen,Waiting for a refund for over a month,Waiting for a refund for over a month. Contacted nike through online chat 3 times - told that they are waiting to process the refund. Still no indication of a refund timeline.,1,Bad,2020-10-08,1,Ireland,waiting refund month contacted nike online chat times told waiting process refund still indication refund timeline,waiting refund month
Gerry,Nike Men's Revolution 5 Running Shoes,"Great for daily walking. Best design for the heel in my opinion, the support is seriously amazing. Lightweight shoes for running and walking. Way to go Nike!",5,Excellent,2020-10-08,3,Philippines,great daily walking best design heel opinion support seriously amazing lightweight shoes running walking way go nike,nike mens revolution running shoes
Anders Sjöstrand,Hey NIKE what is wrong with u????,"Hey NIKE what is wrong with u????Been trying to get my refund for ages now and had numerous contacts via phone. Unbelievably bad support system u CHOOSE to have. Every time I contact I have to repeat my story and thenut seems not possible to b connected to a correct person that can update and actually help...instead I have to wait for 5-10 workingdays for u to call me....this incredibly stupid system have I had to go through...1...2....at least 3 times and still waiting for this refund because of your air shoes that "" collapsed"" within no longer then 3 months. Where is your serviceminded thinking. Ridicoulously bad support!!!!!!!!",1,Bad,2020-10-05,8,Sweden,hey nike wrong ubeen trying get refund ages numerous contacts via phone unbelievably bad support system u choose every time contact repeat story thenut seems possible b connected correct person update actually helpinstead wait workingdays u call methis incredibly stupid system go throughat least times still waiting refund air shoes collapsed within longer months serviceminded thinking ridicoulously bad support,hey nike wrong u
Natalie,Very happy with service and quality,,4,Great,2020-10-05,3,United States,,happy service quality
Oni,Terrible,The [Code: 98D2586B ] is the worst it takes years for them to actually help out overall terrible. Fix their website.,1,Bad,2020-10-04,1,United States,code db worst takes years actually help overall terrible fix website,terrible
Unicorn Rider,I order from nike a lot and don’t…,"I order from nike a lot and don’t normally have issues, however my last few orders have been different.Firstly I returned a recent order on the 25/08/20 and today 03/10/20 I have yet to receive my refund, even though I have spoken to Nike who say they received the return on 1/09/20.So what’s the problem?Apparently they have an error at their end?U have called another 3 times since and the reckon they have a back log of returns and cannot do anything about this until it’s my turn in the queue?Shocking serviceSecondly my last few orders I have noticed a lot of the clothing looks cheaply made and a recent Shield jacket supposedly waterproof was quite the opposite I’m losing faith in Nike as a brand after recent orders.",1,Bad,2020-10-03,40,United Kingdom,order nike lot don’t normally issues however last orders differentfirstly returned recent order today yet receive refund even though spoken nike say received return what’s problemapparently error endu called another times since reckon back log returns cannot anything it’s turn queueshocking servicesecondly last orders noticed lot clothing looks cheaply made recent shield jacket supposedly waterproof quite opposite i’m losing faith nike brand recent orders,order nike lot don’t…
Jack,Very nice one,,4,Great,2020-09-24,3,France,,nice one
